CLEAN_NLP,CLEAN_TEXT,dominant_topic,sentimen
perlu adanya studi kasus ke salah satu skpd agar bisa melakukan analisa dan evaluasi terhadap hasil pembelajaran selama pelatihan,studi salah skpd analisa evaluasi hasil pembelajaran pelatihan,2,Positif
sudah sangat baik untuk teknis ada prakteknya,teknis prakteknya,3,Positif
ditingkatkan,ditingkatkan,1,Positif
bisa di adakan secara klasikal,adakan klasikal,3,Positif
waktu lebih untuk ditambahkan sebab banyak materi yg blm sampai selesai,materi yg blm selesai,3,Positif
materinya sangat bermanfaat semoga ke depan semakin sering dilaksanakan pelatihan seperti ini yang sangat membantu persiapan uji kompetensi,materinya bermanfaat semoga dilaksanakan pelatihan membantu persiapan uji kompetensi,2,Positif
